{"columnCounts":[3,1,2,3],"completion":{"mapSegmentId":"s1-section-01-route-01-segment-01","resultTextKey":"result.route-open.standard","trainMomentId":"standard-first-clear"},"content":{"networkSection":1,"position":1,"route":1,"season":1,"statusKey":"level.s1.01.01.01.status","titleKey":"level.s1.01.01.01.title"},"contentRevision":1,"documentSchemaVersion":2,"endpoints":{"a":{"index":0,"side":"N"},"b":{"index":3,"side":"S"}},"grid":{"height":4,"width":4},"production":{"chainDepth":4,"entryDeductionKey":"level.s1.01.01.01.entry","focus":["OCCUPANCY","ENDPOINT_GEOMETRY"],"qualityNote":"Contract fixture only; this file is not an approved Season-1 production level.","starThresholdsSeconds":null,"timeClass":"UNSET"},"proofRef":{"artifactId":"proofs/S1-01-01-01/solver-v2.proof-v1.json","proofFormatVersion":1,"proofHash":{"profile":"STP-PROOF-JCS-1","sha256":"dfdc03486b04a333b70e46d76a45e33bb5d3ae84580aa494558512352a0baa70"}},"puzzleId":"S1-01-01-01","rowCounts":[1,3,4,1],"rulesetVersion":"train-track-v1","solution":{"path":[{"track":"TRACK_NS","x":0,"y":0},{"track":"TRACK_NS","x":0,"y":1},{"track":"TRACK_NE","x":0,"y":2},{"track":"TRACK_EW","x":1,"y":2},{"track":"TRACK_WN","x":2,"y":2},{"track":"TRACK_ES","x":2,"y":1},{"track":"TRACK_SW","x":3,"y":1},{"track":"TRACK_NS","x":3,"y":2},{"track":"TRACK_NS","x":3,"y":3}]}}